{
  "schemaVersion": 1,
  "id": "e7a62606-9f43-54a5-bc02-7cf8e4cf3ced",
  "name": "Shrimp Fettuccine Alfredo",
  "description": "Shrimp fettuccine alfredo is one of the best tasting and low effort dishes.\nThe recipe i give below yields an alfredo sauce that is a bit on the thicker side.\nIf you want a thinner sauce, adding a touch or two more milk will thin out...",
  "cuisine": "Italian",
  "mealType": "Dinner",
  "difficulty": null,
  "prepMinutes": null,
  "cookMinutes": null,
  "totalMinutes": null,
  "servings": null,
  "yieldText": "3-4 servings",
  "ingredients": [
    {
      "name": "Cream cheese",
      "originalText": "1 8oz cream cheese",
      "quantity": 1.0,
      "quantityText": "1",
      "unit": "package",
      "preparation": "8 oz source package size",
      "section": null,
      "optional": false
    },
    {
      "name": "Shrimp",
      "originalText": "1lb uncoocked peeled shrimp",
      "quantity": 1.0,
      "quantityText": "1",
      "unit": "lb",
      "preparation": "uncoocked peeled",
      "section": null,
      "optional": false
    },
    {
      "name": "Milk",
      "originalText": "1/3 cup milk (more milk for thinner sauce)",
      "quantity": 0.3333333333333333,
      "quantityText": "1/3",
      "unit": "cup",
      "preparation": "more milk for thinner sauce",
      "section": null,
      "optional": false
    },
    {
      "name": "Parmesan cheese",
      "originalText": "3/4 cup grated parmesan cheese",
      "quantity": 0.75,
      "quantityText": "3/4",
      "unit": "cup",
      "preparation": "grated",
      "section": null,
      "optional": false
    },
    {
      "name": "Butter",
      "originalText": "2 tblsp butter",
      "quantity": 2.0,
      "quantityText": "2",
      "unit": "tblsp",
      "preparation": null,
      "section": null,
      "optional": false
    },
    {
      "name": "Garlic powder",
      "originalText": "1 tsp garlic powder",
      "quantity": 1.0,
      "quantityText": "1",
      "unit": "tsp",
      "preparation": null,
      "section": null,
      "optional": false
    },
    {
      "name": "Pasta noodles of choice",
      "originalText": "Pasta noodles of choice (e.g. approximately 9oz of fettuccine noodles)",
      "quantity": null,
      "quantityText": null,
      "unit": null,
      "preparation": "e.g. approximately 9oz of fettuccine noodles",
      "section": null,
      "optional": false
    }
  ],
  "instructions": [
    {
      "section": "Preparation",
      "text": "Read the entire method first and measure the following ingredients before turning on the heat: 1 8oz cream cheese; 1lb uncoocked peeled shrimp; 1/3 cup milk (more milk for thinner sauce); 3/4 cup grated parmesan cheese; 2 tblsp butter; 1 tsp garlic powder; Pasta noodles of choice (e.g. approximately 9oz of fettuccine noodles). Keep ingredients marked optional separate until their step."
    },
    {
      "section": "Preparation",
      "text": "Prepare these ingredients before cooking: Shrimp: uncoocked peeled; Parmesan cheese: grated. Wash produce under running water before cutting. Use a cutting board and a sharp knife; keep raw meat and its utensils separate from ready-to-eat ingredients."
    },
    {
      "text": "Grate your Parmesan Cheese",
      "section": "Initial Preparation (5-10 minutes)"
    },
    {
      "text": "Peel your shrimp",
      "section": "Initial Preparation (5-10 minutes)"
    },
    {
      "text": "The dish has two main parts–the Pasta and the Alfredo Sauce.",
      "section": "Initial Preparation (5-10 minutes)"
    },
    {
      "text": "In order that you can have both finish about the same time, I have given estimates on the individual cook times.",
      "section": "Initial Preparation (5-10 minutes)"
    },
    {
      "text": "In a medium saucepan, bring 4 cups of water to a rapid boil.",
      "section": "Preparing the Pasta (10-20 minutes)"
    },
    {
      "text": "Turn down to medium heat (Simmering). A simmer means small, gentle bubbles; lower the burner if it boils vigorously.",
      "section": "Preparing the Pasta (10-20 minutes)"
    },
    {
      "text": "Add your pasta noodles.",
      "section": "Preparing the Pasta (10-20 minutes)"
    },
    {
      "text": "In a large frying pan, add butter, garlic powder, and shrimp.",
      "section": "Preparing the Alfredo Sauce (7-10 minutes)"
    },
    {
      "text": "On medium heat, sauté ingredients until shrimp are cooked. Stir frequently so the ingredients soften evenly without sticking or burning; reduce the heat if they darken too quickly.",
      "section": "Preparing the Alfredo Sauce (7-10 minutes)"
    },
    {
      "text": "Then add the cream cheese broken into chunks.",
      "section": "Preparing the Alfredo Sauce (7-10 minutes)"
    },
    {
      "text": "Stir until creamy.",
      "section": "Preparing the Alfredo Sauce (7-10 minutes)"
    },
    {
      "text": "Once cream cheese is to sauce consistency, add milk.",
      "section": "Preparing the Alfredo Sauce (7-10 minutes)"
    },
    {
      "text": "Stir until light simmer. A simmer means small, gentle bubbles; lower the burner if it boils vigorously.",
      "section": "Preparing the Alfredo Sauce (7-10 minutes)"
    },
    {
      "text": "Add parmesan cheese and continue stirring.",
      "section": "Preparing the Alfredo Sauce (7-10 minutes)"
    },
    {
      "text": "Stir until cheese is mixed.",
      "section": "Preparing the Alfredo Sauce (7-10 minutes)"
    },
    {
      "text": "Remove from heat.",
      "section": "Preparing the Alfredo Sauce (7-10 minutes)"
    },
    {
      "text": "Strain cooked pasta noodles. Use the package cooking-time range, stir to separate the pasta, and taste a cooled piece near the end; it should be tender without a hard center.",
      "section": "Serving"
    },
    {
      "section": "Check doneness",
      "text": "Before serving, check uncooked fish or shrimp with a food thermometer: it must reach 145°F (63°C). Fish should separate easily into flakes; shrimp should be opaque and firm. Continue cooking and recheck if needed."
    },
    {
      "text": "Serve the strained noodles on a plate and top with alfredo sauce.",
      "section": "Serving"
    },
    {
      "section": "Finish",
      "text": "Turn off any burners or oven when cooking is finished. Follow the cooling or resting instruction above before cutting or serving. Serve the finished dish as directed; allow hot portions to cool enough to eat."
    }
  ],
  "preferenceTags": [
    {
      "name": "meal_type",
      "value": "dinner"
    },
    {
      "name": "cuisine",
      "value": "italian"
    },
    {
      "name": "category",
      "value": "italian"
    },
    {
      "name": "category",
      "value": "pasta"
    },
    {
      "name": "category",
      "value": "shrimp"
    }
  ],
  "keywords": [
    "italian",
    "pasta",
    "shrimp",
    "shrimp fettuccine alfredo"
  ],
  "nutrition": null,
  "imageUrl": "https://publicdomainrecipes.com/pix/xmr.svg",
  "source": {
    "kind": "website",
    "url": "https://publicdomainrecipes.com/shrimp-fettuccine-alfredo/",
    "siteName": "Public Domain Recipes",
    "author": "Sergey Bilovytskyy",
    "importedAt": "2026-10-16T22:24:05.819849+00:00",
    "originalInstructions": "Initial Preparation (5-10 minutes): 1. Grate your Parmesan Cheese\nInitial Preparation (5-10 minutes): 2. Peel your shrimp\nInitial Preparation (5-10 minutes): 3. The dish has two main parts–the Pasta and the Alfredo Sauce.\nIn order that you can have both finish about the same time, I have given estimates on the individual cook times.\nPreparing the Pasta (10-20 minutes): 4. In a medium saucepan, bring 4 cups of water to a rapid boil.\nPreparing the Pasta (10-20 minutes): 5. Turn down to medium heat (Simmering).\nPreparing the Pasta (10-20 minutes): 6. Add your pasta noodles.\nPreparing the Alfredo Sauce (7-10 minutes): 7. In a large frying pan, add butter, garlic powder, and shrimp.\nPreparing the Alfredo Sauce (7-10 minutes): 8. On medium heat, sauté ingredients until shrimp are cooked.\nPreparing the Alfredo Sauce (7-10 minutes): 9. Then add the cream cheese broken into chunks.\nPreparing the Alfredo Sauce (7-10 minutes): 10. Stir until creamy.\nPreparing the Alfredo Sauce (7-10 minutes): 11. Once cream cheese is to sauce consistency, add milk.\nPreparing the Alfredo Sauce (7-10 minutes): 12. Stir until light simmer.\nPreparing the Alfredo Sauce (7-10 minutes): 13. Add parmesan cheese and continue stirring.\nPreparing the Alfredo Sauce (7-10 minutes): 14. Stir until cheese is mixed.\nPreparing the Alfredo Sauce (7-10 minutes): 15. Remove from heat.\nServing: 16. Strain cooked pasta noodles.\nServing: 17. Serve the strained noodles on a plate and top with alfredo sauce.",
    "originalIngredients": [
      "1 8oz cream cheese",
      "1lb uncoocked peeled shrimp",
      "1/3 cup milk (more milk for thinner sauce)",
      "3/4 cup grated parmesan cheese",
      "2 tblsp butter",
      "1 tsp garlic powder",
      "Pasta noodles of choice (e.g. approximately 9oz of fettuccine noodles)"
    ],
    "license": "Public domain (Unlicense)",
    "licenseUrl": "https://github.com/ronaldl29/public-domain-recipes/blob/main/LICENSE.md",
    "instructionsOrigin": "adapted",
    "adaptationNotes": "Ingredient amounts and original directions come from the linked public-domain page. Remy added preparation explanations, cooking-technique definitions, serving guidance, and applicable USDA thermometer checks. Unspecified quantities, serving counts, nutrition, and timing remain unknown. These adaptations have not been kitchen-tested."
  }
}
